id,name,project_id1,project_id2,curated_description,num_of_samples,num_of_runs,population,related_publications,original_description,created_at,updated_at
128,PRJNA298762,PRJNA298762,SRP064817,,30,30,0,NULL,"Ulcerative_colitis_(UC)_is_associated_with_colonic_mucosa_barrier_defects_and_bacterial_dysbiosis,_but_these_phenotypes_may_simply_be_the_result_of_inflammation._Therefore,_we_sought_to_assess_whether_these_phenotypes_are_inherently_abrogated_in_the_terminal_ileum_(TI)_of_UC_patients,_where_inflammation_is_absent._",2021-01-21 12:15:08 UTC,2021-01-21 12:15:08 UTC
129,PRJNA298846,PRJNA298846,SRP064871,,79,79,0,NULL,This_study_aims_to_compare_the_microbial_diversity_in_the_stools_of_children_with_and_without_cystic_fibrosis_to_understand_the_effects_of_a_cystic_fibrosis_associated_lifestyle._Children_were_sampled_from_an_age_range_of_approximately_1_to_17_years_old._Our_goal_was_to_pin_point_the_age_at_which_gut_dysbiosis_occurs.,2021-01-21 12:15:08 UTC,2021-01-21 12:15:08 UTC
130,PRJNA298957,PRJNA298957,SRP064975,,98,98,0,NULL,_adenoma_microbial_diversity_,2021-01-21 12:15:08 UTC,2021-01-21 12:15:08 UTC
131,PRJNA299440,PRJNA299440,SRP065106,,52,56,0,NULL,"We_aimed_to_determine_the_microbial_composition_of_colorectal_mucosa_among_patients_with_traditional_adenoma,_sessile_serrated_adenoma/polyp,_or_colorectal_cancer._",2021-01-21 12:15:08 UTC,2021-01-21 12:15:08 UTC
132,PRJNA299502,PRJNA299502,ERP104233,NULL,37,37,0,26671671,Gut microbiome diversity among the Cheyenne & Arapaho of Oklahoma,2021-01-21 12:15:08 UTC,2021-01-21 12:15:08 UTC
133,PRJNA301903,PRJNA301903,SRP069019,,422,924,0,27572443,"Dysbiotic colonization of the preterm infant gut microbiota may have lifelong effects on host health. The normal progression of colonization of preterm infants is a patterned, yet chaotic, process, and thought to be chiefly driven by host factors. While preterm infants almost universally receive early and often repeated and/or prolonged intravenous antibiotic therapy, it remains unclear if and how specific antibiotics alter the developmental progression of the gut microbiota in this population. By analyzing 401 fecal samples from 84 longitudinally-sampled preterm infants, we demonstrate that meropenem, cefotaxime, and ticarcillin-clavulanate significantly reduce species richness during their administration, and significantly enrich or deplete specific bacterial species and antibiotic resistance (AR) genes. In contrast, vancomycin and gentamicin, the antibiotics most commonly administered to preterm infants, have non-uniform effects on species richness. We show this response is predictable with 85% accuracy based on the relative abundance of only two bacterial species and two AR genes before treatment. To more fully investigate the role of the gut-associated resistome in response to specific antibiotics, we performed functional metagenomic selections for resistance to 16 clinically relevant antibiotics from a set of 21 preterm infants? gut microbiota. Of the 794 AR genes identified, 79% had not previously been classified as providing any resistance phenotype. Combined with deep shotgun sequencing of all 401 fecal samples, we find that multidrug resistant Escherichia, Klebsiella, and Enterobacter species, which are commonly associated with nosocomial infections, dominate the preterm infant gut microbiota. We show that AR genes that are enriched following specific antibiotic treatments are generally unique to the specific treatment and highly correlated (p<0.001) with the abundance of a single species. The most notable exception includes ticarcillin-clavulanate and ampicillin, both of which enrich a large number of overlapping AR genes, and are highly correlated with Klebsiella pneumoniae species in the preterm infant gut microbiota. In addition to AR genes relevant to specific antibiotics likely providing a protective function, we show that all antibiotic treatments also result in widespread collateral microbiome impact through enrichment  of AR genes with no known direct activity against the specific antibiotic treatment.",2021-01-21 12:15:08 UTC,2021-01-21 12:15:08 UTC
134,PRJNA302437,PRJNA302437,SRP066323,,2,152,0,NULL,Microbiome Analysis of IBS Patients,2021-01-21 12:15:08 UTC,2021-01-21 12:15:08 UTC
135,PRJNA302456,PRJNA302456,SRP073805,,1,1,0,26288821,"Adults age 50-74 presenting to either of two Shanghai community health centers for colorectal cancer screening were recruited to provide an additional fecal specimen (in RNAlater) if their screening sample was positive for occult blood. Fecal DNA was extracted, amplified for V3-V4 16S rRNA sequences, and paired-end sequenced by Illumina.",2021-01-21 12:15:08 UTC,2021-01-21 12:15:08 UTC
136,PRJNA302832,PRJNA302832,SRP066514,,78,78,0,NULL,16S ribosomal RNA (rRNA) gene amplicon sequencing of fecal samples collected from melanoma patients prior to ipilimumab treatment,2021-01-21 12:15:08 UTC,2021-01-21 12:15:08 UTC
137,PRJNA30563,PRJNA30563,SRP000222,NULL,2,4,0,18976571,"DNA from diarrheal patient's feces was subjected to high-throughput DNA sequencing. Significant number of reads showed best hits for the Campylobacter jejuni sequences, demonstrating the presence of this pathogen. This study is the first to report the direct detection of a bacterial pathogen from human specimens by using high-throughput sequencing",2021-01-21 12:15:08 UTC,2021-01-21 12:15:08 UTC
138,PRJNA311208,PRJNA311208,SRP069867,NULL,11,16,0,27406942,This is a prospective cohort study using metagenomics to characterize gut microbiota populations of pediatric short bowel syndrome (SBS) patients with variable growth trajectories. Stool samples were collected from children with SBS and healthy controls over a three month period. Differences in gut bacterial populations were compared between healthy children and those with SBS (including a more in depth analysis of SBS children exhibiting poor and good growth),2021-01-21 12:15:08 UTC,2021-01-21 12:15:08 UTC
139,PRJNA318788,PRJNA318788,SRP073516,NULL,18,18,0,27025251,This study investigates the transfer of viral populations during human fecal microbiota transplants.,2021-01-21 12:15:08 UTC,2021-01-21 12:15:08 UTC
140,PRJNA321218,PRJNA321218,SRP074801,NULL,3,3,0,"2,413,754,027,819,660","Cyanobacteria were responsible for the oxygenation of the ancient atmosphere; however, the evolution of this phylum is enigmatic, as relatives have not been characterized. Here we use whole genome reconstruction of human fecal and subsurface aquifer metagenomic samples to obtain complete genomes for members of a new candidate phylum sibling to Cyanobacteria, for which we propose the designation â__elainabacteriaâ__. Metabolic analysis suggests that the ancestors to both lineages were non-photosynthetic, anaerobic, motile, and obligately fermentative. Cyanobacterial light sensing may have been facilitated by regulators present in the ancestor of these lineages. The subsurface organism has the capacity for nitrogen fixation using a nitrogenase distinct from that in Cyanobacteria, suggesting nitrogen fixation evolved separately in the two lineages. We hypothesize that Cyanobacteria split from Melainabacteria prior or due to the acquisition of oxygenic photosynthesis. Melainabacteria remained in anoxic zones and differentiated by niche adaptation, including for symbiosis in the mammalian gut",2021-01-21 12:15:08 UTC,2021-01-21 12:15:08 UTC
141,PRJNA339264,PRJNA339264,SRP094608,NULL,715,715,0,28095889,"The aim of this study was to characterise the gut microbiota development in a cohort of breast-fed infants from 1 to 24 weeks of age, using both culture-independent 16S rRNA amplicon sequencing and, in parallel, bacteriological culture. Mode of delivery (Spontaneous Vaginally Delivered (SVD), or Caesarean Section (CS)), and gestational age (pre-term (PT) or full-term (FT)), have significant effects on early neonatal microbiota composition. The data show the longitudinal effect of PT birth after the infant leaves the hospital environment",2021-01-21 12:15:08 UTC,2021-01-21 12:15:08 UTC
142,PRJNA342805,PRJNA342805,SRP089798,NULL,96,96,0,27147260,"To address the issue of Blastocystis pathogenicity, we investigated the impact of colonization by this protist on the composition of the human gut microbiota.",2021-01-21 12:15:08 UTC,2021-01-21 12:15:08 UTC
143,PRJNA344791,PRJNA344791,SRP090778,NULL,43,43,0,28262770,"The goal of this study was to characterise the fecal bacterial communities of HIV-infected individuals on long-term antiretroviral therapy on two distinct regimens based on either Non-Nucleoside Reverse Transcriptase Inhibitors or ritonavir-boosted protease inhibitors with the same backbone of Nucleoside Reverse Transcriptase Inhibitors and compared them to HIV-uninfected individuals from Mexico. To achieve this goal we conducted a cross-sectional study by sampling the feces and using 16S ribosomal RNA (16sRNA) targeted sequencing. Fecal bacterial community changes that occur in HIV positive individuals on different antiretroviral therapy regimens are important to understand, as they are potentially linked with chronic inflammation and microbiome-linked comorbidities that occur at increased incidence in this population.This is the first report to address the fecal bacterial communities in HIV-infected individuals on two ARV regimens from Mexico",2021-01-21 12:15:08 UTC,2021-01-21 12:15:08 UTC
144,PRJNA345074,PRJNA345074,SRP091057,NULL,20,20,0,26628508,"Objectives Preventing postoperative recurrence after ileocolonic resection (ICR) for Crohnâ__s disease (CD) is challenging. Defining the disturbances of the microbial composition and community structure after ICR and their link with early disease recurrence is crucial. Design Microbiota composition (fingerprinting and 16S rDNA sequencing) and community structure (correlation networks of bacterial species) were assessed from ileal mucosa sampled in 20 patients undergoing ICR and 6 months later during endoscopy from above (neoterminal ileum) and below (subanastomotic colon) the surgical anastomosis. Results ICR had a dramatic effect on gut microbial ecosystem. At surgery, CD mucosa harboured a dysbiotic microbiota with high proportions of _±/_² Proteobacteria and Bacilli. Six months later, half of the patients had recurrent lesions at ileocolonoscopy and presented higher numbers of Lachnospiraceae. Recurrence of endoscopic lesions was associated with enrichment in Enterococcus durans while patients in remission had increased proportions of Dorea longicatena and Bacteroides plebeius. Structural differences were striking between recurrence and remission microbiota; while the microbiota of patients with CD recurrence exhibited a loose community structure, the microbiota of patients in remission displayed communities that were robustly correlated to each other. Microbiota colonising the neoterminal ileum and subanastomotic colon 6 months after ICR only differed in patients with recurrence. Conclusions ICR modifies the gut microbiome. Remission after 6 months was associated with homogenous bacterial distribution around the anastomosis. Community structure and bacterial networks highlight target species, including Faecalibacterium prausnitzii and Ruminococcus gnavus, which may allow precise modulations of the overall microbial ecosystem towards remission pattern",2021-01-21 12:15:08 UTC,2021-01-21 12:15:08 UTC
145,PRJNA353587,PRJNA353587,SRP093360,NULL,83,83,0,28539351,study gut bacterial microbiome of C.difficile infected patients,2021-01-21 12:15:08 UTC,2021-01-21 12:15:08 UTC
146,PRJNA355023,PRJNA355023 ,SRP093968,,54,54,0,NULL,"Autism spectrum disorders (ASDs) is associated with a series of neuro developmental anarchy and is characterized by deficits in social and cognitive functions. In this study, we compared the structure of the fecal microbiota of autistic children with matched healthy children from Indian population.",2021-01-21 12:15:08 UTC,2021-01-21 12:15:08 UTC
147,PRJNA355083,PRJNA355083,SRP095005,NULL,18,18,0,28178201,"Rett syndrome (RTT) patients are characterized by an altered gastrointestinal homeostasis that results in gastrointestinal discomfort, persistent inflammation and altered immune responses. Changes in microbiota composition, as observed in other neurological disorders such as autism, may account for several typical symptoms associated to RTT. Recent studies have suggested that changes in the bacteria (microbiota) of the gastrointestinal tract may affect the function of the nervous system. In this project, we characterized the composition of gut bacteria and main metabolic end-products, short fatty acids (SCFAs), in a group of 7 girls with RTT and 10 healthy subjects",2021-01-21 12:15:08 UTC,2021-01-21 12:15:08 UTC
148,PRJNA355138,PRJNA355138,SRP094857,,42,43,0,NULL,"These samples were included in project ""Open-label pilot trial to reduce immune activation via fecal microbiome transplantation in HIV-infected, antiretroviral-treated subjects"" Contact: Ivan Vujkovic-Cvijin, Principal Investigator: Somsouk, Ma",2021-01-21 12:15:08 UTC,2021-01-21 12:15:08 UTC
149,PRJNA355863,PRJNA355863,SRP094395,NA,1,1,0,27336782,"In this study, we compared the gut microbiota of 8 PKU patients on Phe-restricted dietary treatment with that of 10 healthy individuals. The microbiota were characterized by 16S rRNA sequencing using the Ion Torrent_ platform. The most dominant phyla detected in both groups were Bacteroidetes and Firmicutes. PKU patients showed reduced abundance of the Clostridiaceae, Erysipelotrichaceae, and Lachnospiraceae families, Clostridiales class, Coprococcus, Dorea, Lachnospira, Odoribacter, Ruminococcus and Veillonella genera, and enrichment of Prevotella, Akkermansia, and Peptostreptococcaceae. Microbial function prediction suggested significant differences in starch/glucose and amino acid metabolism between PKU patients and controls. Together, our results suggest the presence of distinct taxonomic groups within the gut microbiome of PKU patients, which may be modulated by their plasma Phe concentration. Whether our findings represent an effect of the disease itself, or a consequence of the modified diet is unclear",2021-01-21 12:15:08 UTC,2021-01-21 12:15:08 UTC
150,PRJNA356102,PRJNA356102,SRP094805,NA,168,168,0,NULL,"Gut microbiome make contributions to human host, and intestinal dysbiosis is associated with rheumatoid arthritis. Here we firstly demonstrated that the human gut microbiome related to rheumatoid arthritis could be divided into subtyping groups under different human enterotypes, which indicate the associations between rheumatoid arthritis and gut microbiome were diverse. In rheumatoid arthritis-related microbiota, Prevotella could be an indicator of early rheumatoid arthritis patients but insufficient to differentiate RA patients from healthy controls, and Bacteroides coprocola enriched in group 3 and Bacteroides dorei enriched in group 4 were considered to be as indicators of serious rheumatoid arthritis patients. Our findings provide additional evidences supporting that rheumatoid arthritis is a heterogeneous disease. Thus, the study of association between disease and gut microbiome should be conducted under different human gut enterotypes",2021-01-21 12:15:08 UTC,2021-01-21 12:15:08 UTC
151,PRJNA356225,PRJNA356225,SRP095060,NA,150,150,0,NULL,This study presented the bacterial diversity of human stool sample from the Vogt-Koyanagi-Harada disease patients in Chinese population,2021-01-21 12:15:08 UTC,2021-01-21 12:15:08 UTC
152,PRJNA356507,PRJNA356507,SRP094833,NA,43,45,0,27507964?27028797?26588090?24987952 ?24732106?24402126,"Background & aims. Obesity has suffered of a dramatic increase over the last decades especially in childhood. In recent years, several experimental and clinical studies have provided the evidences of the involvement of gut microbiota in obesity. Particularly, gut bacteria has shown to play a critical role in the regulation of host energy metabolism and body mass . The aim of this study was to investigate the composition of the gut microbiota in obese adolescents and adults compared to age matched healthy volunteers to identify age-related microbiota profiles correlated with obesity.\nMethods. A group of 25 adolescent and 20 adult obese patients were analyzed for gut microbiota composition by 16S rRNA targeted metagenomics and compared to 12 adolescents and 12 adult normal weight healthy volunteers (control group). The ?- and ?-diversity was evaluated, and univariate, multivariate and correlation analysis were performed on bacterial taxa profiles.\n\nResults. By ?- and ?-diversity analysis showed ecological dissimilarity among the 4 study groups. At phylum level, comparison between obese versus normal weight adolescents revealed differences in Actinobacteria, Bacteroidetes and Firmicutes abundances, while, comparing adolescent versus adult obese, Actinobacteria and Bacteroidetes proportions resulted different.\n\nConclusions. The present study revealed unique features of gut microbiome in ecological diversity, composition and OTUs correlation patterns in obese adolescent, in comparison to normal weight healthy adolescents, but also in obese and normal weight healthy adults. The assessment of possible biomarkers in microbiota profiling could lead in developing tailored-obesity treatments as new probiotic drugs. The futures investigation of probiotics for obese adolescent should consider the different microbiota profiles strictly age-related",2021-01-21 12:15:08 UTC,2021-01-21 12:15:08 UTC
153,PRJNA356629,PRJNA356629,SRP095203,NA,38,38,0,NULL,Atopic dermatitis (AD) is a common childhood disorder with a complex pathogenesis. AD in children is commonly associated with increased sensitization to food allergens. The incidence of AD and food allergy has been increasing in recent decades and has been linked to greater hygiene and to changes in the environment that may alter the gut microbiome. A majority of current studies on the microbiome in AD and food sensitization is done on western populations. Studying African patients with a relatively lower incidence of food allergy could provide important clues about the protective effect of the environment on AD and food sensitization,2021-01-21 12:15:08 UTC,2021-01-21 12:15:08 UTC
154,PRJNA360073,PRJNA360073,SRP100762,NA,456,456,0,NULL,Effect of an intervention with probiotics in early life on gut microbiota,2021-01-21 12:15:08 UTC,2021-01-21 12:15:08 UTC
155,PRJNA362245,PRJNA362245,SRP099070,NULL,36,36,0,"2,416,957,728,630,470","We followed the development of the gut, oral, and skin microbiomes of six low-birthweight neonates using 16S rRNA gene-based surveys and performed a follow-up study in which the oral microbiome of one neonate was characterized using genome-resolved metagenomics",2021-01-21 12:15:08 UTC,2021-01-21 12:15:08 UTC
156,PRJNA362958,PRJNA362958,SRP097639,NA,40,40,0,25434931,Pediatric spondyloarthritis patients versus healthy controls,2021-01-21 12:15:08 UTC,2021-01-21 12:15:08 UTC
157,PRJNA368739,PRJNA368739,SRP097785,NA,531,531,0,NULL,"The gut microbiome is complex and metabolically active community that directly influences host phenotype. In this study, we profiled gut microbiota using 16S rRNA gene sequencing in 531 well-phenotyped Finnish men collected from the population-based Metabolic Syndrome In Men (METSIM) study",2021-01-21 12:15:08 UTC,2021-01-21 12:15:08 UTC
158,PRJNA368966,PRJNA368966,SRP098586,NA,109,109,0,NULL,"Compare and find specific features of gut bacterial communities in PSC, PSC-IBD and UC patient in comparison with healthy controls",2021-01-21 12:15:08 UTC,2021-01-21 12:15:08 UTC
159,PRJNA373876,PRJNA373876,SRP099239,NA,52,52,0,NULL,"Preclinical and clinical evidence supports the concept of bidirectional brain gut microbiome interactions. We aimed to determine if subgroups of irritable bowel syndrome subjects (IBS) can be identified based on differences in gut microbial composition, and if there are correlations between gut microbial measures and structural brain signatures in IBS.\nBehavioral measures, stool samples and structural brain images were collected from 30 adult IBS and 23 healthy control subjects (HCs). 16S rRNA gene sequencing (V3-V5 region, 454 platform) was used to characterize stool microbial communities. T1 weighted brain images were acquired on a Siemens Allegra 3T scanner, and morphological measures were computed for 165 brain regions",2021-01-21 12:15:08 UTC,2021-01-21 12:15:08 UTC
160,PRJNA373901,PRJNA373901,SRP100446,NA,86,86,0,NULL,"The presence of advanced fibrosis in nonalcoholic fatty liver disease (NAFLD) is the most important predictor of liver mortality. The aim of this study was to examine the diagnostic\naccuracy of a gut-microbiota derived metagenomic signature for detecting the presence of advanced fibrosis in NAFLD. In this prospective study, we characterized the microbiome signatures associated with advanced fibrosis (defined as stage 3 or 4 fibrosis) in uniquely well characterized biopsy- and imaging-phenotyped patients with NAFLD. Gut microbiome\n\ncompositions of the patients were determined using whole-genome shotgun sequencing of DNA extracted from stool samples",2021-01-21 12:15:08 UTC,2021-01-21 12:15:08 UTC
161,PRJNA375772,PRJNA375772,SRP100168,NA,374,388,0,NULL,"We performed 16S rRNA gene sequencing on gastric mucosal samples obtained from subjects with superficial gastritis, atrophic gastritis, intestinal metaplasia and gastric cancer",2021-01-21 12:15:08 UTC,2021-01-21 12:15:08 UTC
162,PRJNA375935,PRJNA375935,SRP100575,NA,211,211,0,NULL,"To reveal the relationship between the gut microbiome and ankylosing spondylitis, a quantitative metagenomics study that was based on deep shotgun sequencing of the gut microbial DNA from 211 Chinese individuals (97 patients and 104 healthy controls) was carried out",2021-01-21 12:15:08 UTC,2021-01-21 12:15:08 UTC
163,PRJNA376506,PRJNA376506,SRP103282,NA,435,435,0,NULL,"In immunocompromised patients, the influence of microbiological host factors, particularly the patients_ gut microbiome on the course of colonization with multi-resistant bacteria like ESBL-producing Enterobacteriaceae (ESBL-E) and vancomycin-resistant Enterococci (VRE), is largely unknown. Recent studies indicate that oncological therapy, antibiotic treatment and presence of inflammation lead to a shift in the microbial composition in the gut and, thus, facilitate bloodstream infections and horizontal gene transfer. The present study aims to further elucidate the underlying processes in a longitudinal cohort study of hematological high risk patients.",2021-01-21 12:15:08 UTC,2021-01-21 12:15:08 UTC
164,PRJNA378749,PRJNA378749,SRP101879,NA,203,203,0,NULL,16S Illumina sequencing was used to identify the bacterial species present within stool samples of healthy human subjects after giving supplements of Lactobacillus johnsonii N6.2 over a certain period. Roughly half the subjects were given the Lactobacillus johnsonii N6.2 supplement and the other half were given a placebo. The goal of this study was to assess if the administration of Lactobacillus johnsonii N6.2 caused shifts in the gut microbiota,2021-01-21 12:15:08 UTC,2021-01-21 12:15:08 UTC
165,PRJNA379123,PRJNA379123,SRP101858,NA,231,231,0,NULL,"Gut microbiota composition was assessed in fecal samples of treatment-naïve JIA patients at baseline, in inactive disease and in persistent activity, and compared those to healthy control samples. Gut microbiota composition was determined by targeted-metagenomics.",2021-01-21 12:15:08 UTC,2021-01-21 12:15:08 UTC
166,PRJNA379437,PRJNA379437,SRP102821,NA,454,454,0,NULL,Investigating fungal colonization of the healthy adult intestinal tract,2021-01-21 12:15:08 UTC,2021-01-21 12:15:08 UTC
167,PRJNA379766,PRJNA379766,SRP102263,NA,48,48,0,NULL,Human gut microbiota sequencing (on V3-V4 regions of 16S rRNA) in psoriasis patients,2021-01-21 12:15:08 UTC,2021-01-21 12:15:08 UTC
168,PRJNA379979,PRJNA379979,SRP110532,NA,438,438,0,NULL,"Antibiotics are not only the primary risk factor for the development of C. difficile infection but are also the standard treatment employed to eradicate it. C diff patients treated with vancomycin, the standard therapy, have a high rate of recurrence of infection (~25%), often requiring hospitalization. Ridinilazole is a C diff-targeted antibiotic which has a lower rate of recurrence.This study examined the effect on the intestinal microbiota of a 10 day course of treatment of C diff patients with either vancomycin or ridinilazole, with stool samples collected prior to treatment, after 5 days, at end of treatment, and 15 and 30 days after cessation of antibiotic",2021-01-21 12:15:08 UTC,2021-01-21 12:15:08 UTC
169,PRJNA380118,PRJNA380118,SRP102473,NA,7,7,0,NULL,"Gut metagenomes were isolated from healthy Russian teenagers living in Moscow, Russia",2021-01-21 12:15:08 UTC,2021-01-21 12:15:08 UTC
170,PRJNA380944,PRJNA380944,SRP102742,NA,24,24,0,29361092,"The goal of this study was to assess the safety and clinical efficacy of fecal microbiota transplantation in pediatric IBD patients. In addition to this, stool samples were collected from donors and recipients at different time points and analyzed",2021-01-21 12:15:09 UTC,2021-01-21 12:15:09 UTC
171,PRJNA381395,PRJNA381395,SRP103427,NA,232,266,0,28843021,"Amplicon sequencing and metagenomic data of nasal and stool samples of PD patients, RBD patients and healthy controls.",2021-01-21 12:15:09 UTC,2021-01-21 12:15:09 UTC
172,PRJNA382861,PRJNA382861,SRP103896,NA,263,263,0,NULL,"Gut microbiota of CHB patients, 16S rRNA V3-V4",2021-01-21 12:15:09 UTC,2021-01-21 12:15:09 UTC
