id,name,project_id1,project_id2,curated_description,num_of_samples,num_of_runs,population,related_publications,original_description,created_at,updated_at
1,PRJDB4038,PRJDB4038,DRP003166,NULL,239,239,0,27340092,Infant gut microbiota development in the 1st month of life. V1-V2 resion of 16S rRNA gene. approximately 17 sample per infant,2021-01-21 12:15:07 UTC,2021-01-21 12:15:07 UTC
2,PRJDB4360,PRJDB4360,DRP003135,NULL,469,469,0,27220822,Fecal samples from 367 healthy Japanese subjects were analyzed by high-throughput sequencing of amplicons derived from the V3-V4 region of the 16S rRNA gene.,2021-01-21 12:15:07 UTC,2021-01-21 12:15:07 UTC
3,PRJDB4871,PRJDB4871,DRP003306,NULL,66,66,0,24402126,"Patients with pediatric Primary Sclesrosing Cholangitis (PSC) compared with Ulcerative Colitis (UC) and healthy controls. After purifying the bacterial DNA from sample feces, the 16S rDNA V1-V2 region was sequenced for analysis of the bacterial communities. There were fourteen PSC patients and one UC patient were taking salazosulfapyridine (SASP).",2021-01-21 12:15:07 UTC,2021-01-21 12:15:07 UTC
4,PRJDB4998,PRJDB4998,DRP003338,NULL,516,516,0,27894251,Fecal microbiota of Japanese healthy adults. 16s rRNA gene library of V1-V2 hyper variable regions derived from the fecal samples of 516 subjects.,2021-01-21 12:15:07 UTC,2021-01-21 12:15:07 UTC
5,PRJDB5442,PRJDB5442,DRP004054,NULL,40,40,0,28628918,"BACKGROUND/AIMS: &#10;Dysbiosis is associated with various systemic disorders including irritable bowel syndrome (IBS). Fecal microbiota transplantation (FMT) might restore intestinal microbial balance. The study aimed to determine the safety and efficacy of FMT in IBS patients, as well as also positive predictors for FMT.&#10;METHODS: &#10;This was a single-arm, open-label study. Eligible patients were diagnosed based on Rome III Diagnostic Criteria. Fecal materials were administered to the patient via colonoscopy. The primary end point was a change in the Bristol stool form scale at 4 weeks after FMT. Recovery to types 3-4 was considered a clinical response. The secondary end point was a change in intestinal microbiota and psychological status using the Hamilton Rating Scale.&#10;RESULTS: &#10;Ten patients were enrolled. Six patients achieved a clinical response. The diversity of patients 4 weeks after FMT increased significantly compared with patients before FMT, and that of responding patients was significantly higher than non-responder patients. The abundance of Bifidobacterium in effective donors was significantly higher than in ineffective donors and patients. Psychological status of all patients was significantly improved after FMT.&#10;CONCLUSIONS: &#10;FMT for patients with IBS is safe, and relatively effective. Bifidobacterium-rich fecal donor may be a positive predictor for successful FMT. Key Summary: (1) Dysbiosis is associated with various gastrointestinal disorders including IBS. (2) FMT has potential to restore intestinal microbial balance. (3) We showed that FMT improved stool form and psychological status of IBS patients. (4) Bifidobacterium-rich donor efficiently induced symbiosis in IBS patients.",2021-01-21 12:15:07 UTC,2021-01-21 12:15:07 UTC
6,PRJEB11419,PRJEB11419,ERP012803,NULL,12123,14589,0,29795809,"The American Gut project is the largest crowdsourced citizen science project to date. Fecal, oral, skin, and other body site samples collected from thousands of participants represent the largest human microbiome cohort in existence. Detailed health and lifestyle and diet data associated with each sample is enabling us to deeply examine associations between the human microbiome and factors such as diet (from vegan to near carnivore and everything in between), season, amount of sleep, and disease states such as IBD, diabetes, or autism spectrum disorder-as well as many other factors not listed here. The American Gut project also encompasses the British Gut and Australian Gut projects, widening the cohort beyond North America. As the project continues to grow, we will be able to identify significant associations that would not be possible with smaller, geographically and health/disease status-limited cohorts.",2021-01-21 12:15:07 UTC,2021-01-21 12:15:07 UTC
7,PRJEB1220,PRJEB1220,ERP002061,NULL,351,837,0,24997787,"The microbial diversity of environments like the human gut extends far beyond what is covered by reference genomes. Here we present a method for exhaustive and unsupervised co-abundance gene binning across a series of highly complex metagenomic samples. As the method does not rely on previously sequenced reference genomes it allows for discovery of new species, viruses and clonal heterogeneity. We demonstrate the method on human gut microbiome data and identify 7,381 co-abundance gene groups (CAGs) ranging in size from 3 to 6,319 genes. The CAGs represent a wide variety of biological entities including microbial genomes, phages and clonal differences. We name the 741 largest of these metagenomic species (MGS), because they correspond to microbial species. In addition, we establish microbial host affiliations by dependency-associations for many small CAGs. Longitudinal sampling in the same individuals indicates that some of these dependency-associations are important for the persistence of their microbial host",2021-01-21 12:15:07 UTC,2021-01-21 12:15:07 UTC
8,PRJEB12357,PRJEB12357,ERP013827,NULL,55,430,0,"2,712,604,422,728,510","Ten individuals with metabolic syndrome underwent a single faecal microbiota transplantation (FMT): 5 of which were allogenic, the other 5 autologous. Stool samples were collected before FMT (day 0) and days 2, 14, 42 and 84 after FMT; and from the donor before FMT. Metagenomic shotgun sequencing was performed on all samples.",2021-01-21 12:15:07 UTC,2021-01-21 12:15:07 UTC
9,PRJEB12947,PRJEB12947,ERP104200,NULL,1,2,0,"2,906,947,627,306,050",EMG produced TPA metagenomics assembly of the Roux-en-Y gastric bypass surgery of morbidly obese patients shows swift and persistent changes of the individual gut microbiota (GBP) data set,2021-01-21 12:15:07 UTC,2021-01-21 12:15:07 UTC
10,PRJEB13870,PRJEB13870,ERP015450,NULL,196,196,0,28143587,Dysbiosis of gut microbiota contributes to the pathogenesis of hypertension,2021-01-21 12:15:07 UTC,2021-01-21 12:15:07 UTC
11,PRJEB15257,PRJEB15257,ERP016968,NULL,15,15,0,28149696,"These samples were generated to quantify and interrogate the antibiotic resistome within a cohort of premature infants, using shotgun metagenomic sequencing.",2021-01-21 12:15:07 UTC,2021-01-21 12:15:07 UTC
12,PRJEB15418,PRJEB15418,ERP017148,NULL,71,142,0,28222761,"Autism Spectrum Disorders (ASDs) are neurodevelopmental disorders characterized by social and behavioural impairments. In addition to neurological symptoms, ASDs subjects frequently suffer from gastrointestinal abnormalities, thus implying a role of the gut microbiota in ASDs gastrointestinal physiology. Here we characterized the gut microbiota in a cohort of autistic individuals demonstrating the presence of an altered microbial community both at bacterial and fungal level. We observed a reduced incidence of Bacteroidetes in the ASDs group with Collinsella, Corynebacterium, Dorea, Haemophilus and Lactobacillus being the bacterial taxa characterizing the gut microbiota of the ASDs cohort. Furthermore constipation has been associated with different bacterial patterns in autistic and neurotypical subjects, with constipated autistic individuals characterized by high levels of putative pro-inflammatory bacterial taxa belonging to Escherichia/Shigella and Clostridium cluster XVIII. The finding that, besides the bacterial gut microbiota, also the gut mycobiota contribute to the intestinal dysbiosis associated with autism open the possibility for new potential interventions strategies aimed at the relief of gastrointestinal symptoms in ASDs which take into account also fungal component of the gut microbiota",2021-01-21 12:15:07 UTC,2021-01-21 12:15:07 UTC
13,PRJEB1775,PRJEB1775,ERP001956,NULL,44,53,0,28934976,Diagnostic Metagenomics: A Culture-Independent Approach to the Investigation of Bacterial Infections,2021-01-21 12:15:07 UTC,2021-01-21 12:15:07 UTC
14,PRJEB1786,PRJEB1786,ERP002469,NULL,145,147,0,23719380,"Type 2 diabetes (T2D) is a result of complex gene-environment interactions, and several risk factors have been identified, including age, family history, diet, sedentary lifestyle and obesity. Statistical models that combine known risk factors for T2D can partly identify individuals at high risk of developing the disease. However, these studies have so far indicated that human genetics contributes little to the models, whereas socio-demographic and environmental factors have greater influence. Recent evidence suggests the importance of the gut microbiota as an environmental factor, and an altered gut microbiota has been linked to metabolic diseases including obesity, diabetes and cardiovascular disease. Here we use shotgun sequencing to characterize the faecal metagenome of 145 European women with normal, impaired or diabetic glucose control. We observe compositional and functional alterations in the metagenomes of women with T2D, and develop a mathematical model based on metagenomic profiles that identified T2D with high accuracy. We applied this model to women with impaired glucose tolerance, and show that it can identify women who have a diabetes-like metabolism. Furthermore, glucose control and medication were unlikely to have major confounding effects. We also applied our model to a recently described Chinese cohort and show that the discriminant metagenomic markers for T2D differ between the European and Chinese cohorts. Therefore, metagenomic predictive tools for T2D should be specific for the age and geographical location of the populations studied.",2021-01-21 12:15:08 UTC,2021-01-21 12:15:08 UTC
15,PRJEB19090,PRJEB19090,ERP021080,NULL,15,38,0,"2,870,947,227,671,350","Gut microbiome research is rapidly moving towards the functional characterization of the microbiota by means of shotgun meta-omics. Here, we selected a cohort of healthy subjects from an indigenous and monitored Sardinian population to analyze their gut microbiota using both shotgun metagenomics and shotgun metaproteomics. We found a considerable divergence between genetic potential and functional activity of the human healthy gut microbiota, in spite of a quite comparable taxonomic structure revealed by the two approaches. Investigation of inter-individual variability of taxonomic features revealed Bacteroides and Akkermansia as remarkably conserved and variable in abundance within the population, respectively. Firmicutes-driven butyrogenesis (mainly due to Faecalibacterium spp.) was shown to be the functional activity with the higher expression rate and the lower inter-individual variability in the study cohort, highlighting the key importance of the biosynthesis of this microbial by-product for the gut homeostasis. The taxon-specific contribution to functional activities and metabolic tasks was also examined, giving insights into the peculiar role of several gut microbiota members in carbohydrate metabolism (including polysaccharide degradation, glycan transport, glycolysis and short-chain fatty acid production). In conclusion, our results provide useful indications regarding the main functions actively exerted by the gut microbiota members of a healthy human cohort, and support metaproteomics as a valuable approach to investigate the functional role of the gut microbiota in health and disease.",2021-01-21 12:15:08 UTC,2021-01-21 12:15:08 UTC
16,PRJEB19367,PRJEB19367,ERP021378,NULL,28,28,0,NULL,Analysis of stool samples from sickle cell disease patients and healthy controls,2021-01-21 12:15:08 UTC,2021-01-21 12:15:08 UTC
17,PRJEB2054,PRJEB2054,ERP000108,NULL,123,246,0,20203603,A human gut microbial gene catalog established by deep metagenomic sequencing,2021-01-21 12:15:08 UTC,2021-01-21 12:15:08 UTC
18,PRJEB23052,PRJEB23052,ERP104786,NULL,74,74,0,30701194,"The composition of the gut microbiota has been linked to many central nervoussystem disorders, including neuropsychiatric disorders such as autism spectrumdisorders (ASDs). Several studies have shown that changes in the microbiomemay contribute to the symptoms of ASD, and a recently published study showedthat fecal microbiota transfer therapy significantly improved autism symptoms.We performed shotgun metagenome sequencing of ASD patients (n = 43) and TD children (n = 31).",2021-01-21 12:15:08 UTC,2021-01-21 12:15:08 UTC
19,PRJEB23207,PRJEB23207,ERP104944,NULL,14,14,0,29468143,"The human intestinal microbiota is a homeostatic ecosystem with a remarkable impact on human health and the disruption of this equilibrium leads to an increased susceptibility to infection by numerous pathogens. In this study, we used shotgun metagenomic sequencing and two different bioinformatics approaches, to investigate possible changes in the composition of the intestinal microbiota in samples from patients with STEC infection compared to healthy and healed controls, collected during an outbreak caused by a STEC O26:H11 infection. Regardless of the bioinformatic procedure used, a good resolution of the taxonomic profiles of the samples was achieved. The faeces collected from the STEC infected patients showed a lower intestinal abundance of the beneficial microorganisms Bifidobacterium and Clostridiales spp. in comparison to controls where those microorganisms predominated. These differences were observed with both bioinformatic approaches used and seemed to be related with the STEC infection although the variation in the relative abundance of the members of the Bifidobacterium genus could have also been associated with the dysbiotic status following the diarrhoea.Finally, the metagenomic sequencing allowed to identify in the STEC positive samples, all the virulence traits present in the genomes of the STEC O26 that caused the outbreak. The results shown represent a first evidence of the changes occurring in the intestinal microbiota of children in the course of STEC infection and indicate that metagenomics may be a promising tool for the culture-independent clinical diagnosis of the infection.",2021-01-21 12:15:08 UTC,2021-01-21 12:15:08 UTC
20,PRJEB4313,PRJEB4313,ERP003588,NA,3,3,0,NULL,Differences in gut microbiota in CeD patient before and after GFD. The study was aimed at identifying the effect of gluten free diet (GFD) in Celiac disease patient after 6 months of GFD. In this longitudinal study we collected stool sample at two time points before staring GFD and six months after GFD. We observed variation in gut microbal communities. The pathogenic bacteria were not detected at GFD stage. Bifidobacterium has increased 100 fold,2021-01-21 12:15:08 UTC,2021-01-21 12:15:08 UTC
21,PRJEB4335,PRJEB4335,ERP003611,NA,58,58,0,NULL,"We compared the bacteria in fecal samples of individuals with chronic HIV infection (n=16), acute HIV infection (n=3), and a HIV negative control population (n=12) and before and after antiretroviral therapy.",2021-01-21 12:15:08 UTC,2021-01-21 12:15:08 UTC
22,PRJEB4336,PRJEB4336,ERP003612,NA,292,595,0,23985870,"Richness of human gut microbiome correlates with metabolic markers.We are facing a global metabolic health crisis provoked by an obesity epidemic. Here we report the human gut microbial composition in a population sample of 123 non-obese and 169 obese Danish individuals. We find two groups of individuals that differ by the number of gut microbial genes and thus gut bacterial richness. They harbour known and previously unknown bacterial species at different proportions; individuals with a low bacterial richness (23% of the population) are characterized by more marked overall adiposity, insulin resistance and dyslipidaemia and a more pronounced inflammatory phenotype when compared with high bacterial richness individuals. The obese individuals among the former also gain more weight over time. Only a few bacterial species are sufficient to distinguish between individuals with high and low bacterial richness, and even between lean and obese. Our classifications based on variation in the gut microbiome identify subsets of individuals in the general white adult population who may be at increased risk of progressing to adiposity-associated co-morbidities.",2021-01-21 12:15:08 UTC,2021-01-21 12:15:08 UTC
23,PRJEB4927,PRJEB4927,ERP004264,NA,148,148,0,25476529,Alterations of the Fecal Microbiome in Parkinson's Disease,2021-01-21 12:15:08 UTC,2021-01-21 12:15:08 UTC
24,PRJEB6070,PRJEB6070,ERP005534,NULL,328,1419,0,25432777,"Several bacterial species have been implicated in the development of colorectal carcinoma (CRC), but CRC-associated changes of fecal microbiota and their potential for cancer screening remain to be explored. Here we used metagenomic sequencing of fecal samples to identify taxonomic markers that distinguished CRC patients from tumor-free controls in a study population of 156 participants. Accuracy of metagenomic CRC detection was similar to the standard fecal occult blood test (FOBT) and when both approaches were combined, sensitivity improved >45% relative to the FOBT while maintaining its specificity. Accuracy of metagenomic CRC detection did not differ significantly between early and late-stage cancer and could be validated in independent patient and control populations (N=335) from different countries. CRC-associated changes in the fecal microbiome at least partially reflected microbial community composition at the tumor itself, indicating that observed gene pool differences may reveal tumor-related host-microbe interactions. Indeed, we deduced a metabolic shift from fiber degradation in controls to utilization of host carbohydrates and amino acids in CRC patients accompanied by an increase of lipopolysaccharide metabolism. ",2021-01-21 12:15:08 UTC,2021-01-21 12:15:08 UTC
25,PRJEB6092,PRJEB6092,ERP005558,NULL,24,24,0,NULL,"Two diets, Korean and Western diet. Each 6 individuals, half of which lost a lot of weight and half of which lost little weight. Fecal samples taken before and after diet (3 months).",2021-01-21 12:15:08 UTC,2021-01-21 12:15:08 UTC
26,PRJEB6456,PRJEB6456 ,ERP005989,NULL,400,400,0,25974306,"The gastrointestinal tracts of mammalians are sterile in utero and colonized by microorganisms immediately after delivery. The subsequent development of the infant gut microbiota involves a complex succession of microbes, driven by factors such as gestational age, mode of delivery, antibiotic use, hygiene, geographical zone and type of feeding.",2021-01-21 12:15:08 UTC,2021-01-21 12:15:08 UTC
27,PRJEB7331,PRJEB7331,ERP007044,NULL,24,24,0,NULL,metagenomic analysis of human gut microbiome,2021-01-21 12:15:08 UTC,2021-01-21 12:15:08 UTC
28,PRJEB7949,PRJEB7949,ERP008951,NULL,40,40,0,NULL,"Ten IBD and 10 healthy individual's fecal microbiomes were determined by NGS sequencing, to identify features that are unique to each group. This was done using shot-gun metagenomics of DNA extracted from fecal samples and run on a HiSeq 2500.",2021-01-21 12:15:08 UTC,2021-01-21 12:15:08 UTC
29,PRJEB8094,PRJEB8094,ERP009131,NULL,72,1252,0,"2,749,408,826,359,910",The initial state of the human gut microbiome determines its reshaping by antibiotics,2021-01-21 12:15:08 UTC,2021-01-21 12:15:08 UTC
30,PRJEB8201,PRJEB8201,ERP009244,NULL,2,2,0,NULL,"Cultural traditions, diet, and lifestyles of ethnic groups living in different geographic locations can serve as a source of variability in human gut microbiota. To examine the differences in gut microbiome of geographically distinct populations, we have carried out phylogenetic, functional, and metabolite analyses of the distal gut microbiota of healthy adolescents from United States and Egypt using next generation high-throughput sequencing.",2021-01-21 12:15:08 UTC,2021-01-21 12:15:08 UTC
31,PRJNA168470,PRJNA168470,SRP017161,NA,40,40,0,NULL,"Unusually high proportions of autistic children suffer from gastrointestinal problems, suggesting a link between autism and abnormalities in gut microbial function. Disturbances in gut microbial ecosystems not only cause gastrointestinal problems that can exacerbate autistic symptoms, but may also affect the immune and neurological systems. Previous studies have focused primarily on the autism-related presence of pathogenic bacteria. Hence, we investigated autism-related alteration of intestinal bacterial composition by comparing non-autistic and autistic children with or without gastrointestinal symptoms. Interestingly, autistic children tend to have less diverse bacterial communities in their intestines, regardless of noticeable gastrointestinal symptoms. In addition, extensive bioinformatics and statistical analyses discovered that the genus Prevotella was mostly absent in autistic children, which in contrast was found in a large fraction of non-autistic children. Intriguingly, these microbes are known to function as a primary degrader of polysaccharides in gut, suggesting a possible influence of daily diets. In addition, Prevotella was recently reported as a central component of gut microbial communities in humans. Therefore, our findings suggest that the less diverse and imbalanced gut microbial profiles of autistic children make them more susceptible to frequent gastrointestinal disorders.",2021-01-21 12:15:08 UTC,2021-01-21 12:15:08 UTC
32,PRJNA177201,PRJNA177201,ERP104075,NULL,27,27,0,23212374,The gut metagenome Third Party Annotation (TPA) assembly was derived from the primary whole genome shotgun (WGS) data set PRJNA177201. This project includes samples from the following biomes : Human gut.,2021-01-21 12:15:08 UTC,2021-01-21 12:15:08 UTC
33,PRJNA188481,PRJNA188481,SRP019038,NULL,8,8,0,24843156,Linking Lifestyle to the Oral and Gut Microbiota in a Large Prospective Cohort.,2021-01-21 12:15:08 UTC,2021-01-21 12:15:08 UTC
34,PRJNA213803,PRJNA213803,SRP028362,NULL,93,93,0,24083370,"BACKGROUND: &#10;Elucidating gut microbiota among gallstone patients as well as the complex bacterial colonization of cholesterol gallstones may help in both the prediction and subsequent lowered risk of cholelithiasis. To this end, we studied the composition of bacterial communities of gut, bile, and gallstones from 29 gallstone patients as well as the gut of 38 normal individuals, examining and analyzing some 299, 217 bacterial 16S rRNA gene sequences from 120 samples.&#10;RESULTS: &#10;First, as compared with normal individuals, in gallstone patients there were significant (P < 0.001) increases of gut bacterial phylum Proteobacteria and decreases of three gut bacterial genera, Faecalibacterium, Lachnospira, and Roseburia. Second, about 70% of gut bacterial operational taxonomic units (OTUs) from gallstone patients were detectable in the biliary tract and bacteria diversity of biliary tract was significantly (P < 0.001) higher than that of gut. Third, analysis of the biliary tract core microbiome (represented by 106 bacteria OTUs) among gallstone patients showed that 33.96% (36/106) of constituents can be matched to known bacterial species (15 of which have publicly available genomes). A genome-wide search of MDR, BSH, bG, and phL genes purpotedly associated with the formation of cholesterol gallstones showed that all 15 species with known genomes (e.g., Propionibacterium acnes, Bacteroides vulgates, and Pseudomonas putida) contained at least contained one of the four genes. This finding could potentially provide underlying information needed to explain the association between biliary tract microbiota and the formation of cholesterol gallstones.&#10;CONCLUSIONS: &#10;To the best of our knowledge, this is the first study to discover gut microbiota dysbiosis among gallstone patients, the presence of which may be a key contributor to the complex bacteria community assembly linked with the presence of cholesterol gallstones. Likewise, this study also provides the first large-scale glimpse of biliary tract microbiota potentially associated with cholesterol gallstones. Such a characterization of the biliary tract core microbiome has potentially important biological and medical implications regarding the role of bacteria in the formation cholesterol gallstones",2021-01-21 12:15:08 UTC,2021-01-21 12:15:08 UTC
35,PRJNA215106,PRJNA215106,ERP104044,NULL,22,169,0,24236055,"Functional metagenomic selections were performed from various pediatric fecal metagenomes, enriched for children in the first two years of life. A major goal was to understand how antibiotic resistance genes establish and propagate among developing intestinal microbiomes. Fecal metagenomic DNA was cloned into an E. coli library and subjected to selections for antibiotic resistance. After selection, resistance-conferring fragments (the only fragments conferring survival to E. coli in the presence of the drugs) were PCR-amplified, sequenced, and assembled.",2021-01-21 12:15:08 UTC,2021-01-21 12:15:08 UTC
